{
  "schema": "axm.living-city.building-shell/v0.10.0",
  "id": "building_courtyard_walkup",
  "name": "Courtyard Walk-up",
  "type": "two_storey_apartment",
  "placeIds": [
    "home_courtyard_1",
    "home_courtyard_2"
  ],
  "footprint": {
    "x": 4,
    "y": 1,
    "w": 4,
    "h": 2
  },
  "frontSide": "south",
  "storeys": [
    {
      "id": "building_courtyard_walkup_s0_storey",
      "level": 0,
      "label": "Ground floor",
      "heightMeters": 3.1,
      "placeIds": [
        "home_courtyard_1"
      ],
      "wallGraph": {
        "nodes": [
          {
            "id": "building_courtyard_walkup_s0_nw",
            "x": 0,
            "y": 0,
            "z": 0
          },
          {
            "id": "building_courtyard_walkup_s0_ne",
            "x": 16,
            "y": 0,
            "z": 0
          },
          {
            "id": "building_courtyard_walkup_s0_se",
            "x": 16,
            "y": 8,
            "z": 0
          },
          {
            "id": "building_courtyard_walkup_s0_sw",
            "x": 0,
            "y": 8,
            "z": 0
          }
        ],
        "edges": [
          {
            "id": "building_courtyard_walkup_s0_north",
            "from": "building_courtyard_walkup_s0_nw",
            "to": "building_courtyard_walkup_s0_ne",
            "side": "north",
            "lengthMeters": 16,
            "kind": "exterior_wall",
            "openingIds": [
              "building_courtyard_walkup_s0_window_02",
              "building_courtyard_walkup_s0_window_06"
            ]
          },
          {
            "id": "building_courtyard_walkup_s0_east",
            "from": "building_courtyard_walkup_s0_ne",
            "to": "building_courtyard_walkup_s0_se",
            "side": "east",
            "lengthMeters": 8,
            "kind": "exterior_wall",
            "openingIds": [
              "building_courtyard_walkup_s0_window_03"
            ]
          },
          {
            "id": "building_courtyard_walkup_s0_south",
            "from": "building_courtyard_walkup_s0_se",
            "to": "building_courtyard_walkup_s0_sw",
            "side": "south",
            "lengthMeters": 16,
            "kind": "exterior_wall",
            "openingIds": [
              "building_courtyard_walkup_s0_window_01",
              "building_courtyard_walkup_s0_window_05",
              "building_courtyard_walkup_s0_street_door"
            ]
          },
          {
            "id": "building_courtyard_walkup_s0_west",
            "from": "building_courtyard_walkup_s0_sw",
            "to": "building_courtyard_walkup_s0_nw",
            "side": "west",
            "lengthMeters": 8,
            "kind": "exterior_wall",
            "openingIds": [
              "building_courtyard_walkup_s0_window_04"
            ]
          }
        ]
      },
      "openings": [
        {
          "id": "building_courtyard_walkup_s0_window_01",
          "type": "window",
          "wallEdgeId": "building_courtyard_walkup_s0_south",
          "offsetRatio": 0.18,
          "widthMeters": 1.15,
          "heightMeters": 1.35,
          "sillMeters": 0.9,
          "sourcePlaceIds": [
            "home_courtyard_1"
          ]
        },
        {
          "id": "building_courtyard_walkup_s0_window_02",
          "type": "window",
          "wallEdgeId": "building_courtyard_walkup_s0_north",
          "offsetRatio": 0.41,
          "widthMeters": 1.15,
          "heightMeters": 1.35,
          "sillMeters": 0.9,
          "sourcePlaceIds": [
            "home_courtyard_1"
          ]
        },
        {
          "id": "building_courtyard_walkup_s0_window_03",
          "type": "window",
          "wallEdgeId": "building_courtyard_walkup_s0_east",
          "offsetRatio": 0.64,
          "widthMeters": 1.15,
          "heightMeters": 1.35,
          "sillMeters": 0.9,
          "sourcePlaceIds": [
            "home_courtyard_1"
          ]
        },
        {
          "id": "building_courtyard_walkup_s0_window_04",
          "type": "window",
          "wallEdgeId": "building_courtyard_walkup_s0_west",
          "offsetRatio": 0.23,
          "widthMeters": 1.15,
          "heightMeters": 1.35,
          "sillMeters": 0.9,
          "sourcePlaceIds": [
            "home_courtyard_1"
          ]
        },
        {
          "id": "building_courtyard_walkup_s0_window_05",
          "type": "window",
          "wallEdgeId": "building_courtyard_walkup_s0_south",
          "offsetRatio": 0.46,
          "widthMeters": 1.15,
          "heightMeters": 1.35,
          "sillMeters": 0.9,
          "sourcePlaceIds": [
            "home_courtyard_1"
          ]
        },
        {
          "id": "building_courtyard_walkup_s0_window_06",
          "type": "window",
          "wallEdgeId": "building_courtyard_walkup_s0_north",
          "offsetRatio": 0.69,
          "widthMeters": 1.15,
          "heightMeters": 1.35,
          "sillMeters": 0.9,
          "sourcePlaceIds": [
            "home_courtyard_1"
          ]
        },
        {
          "id": "building_courtyard_walkup_s0_street_door",
          "type": "external_door",
          "wallEdgeId": "building_courtyard_walkup_s0_south",
          "offsetRatio": 0.5,
          "widthMeters": 1.05,
          "heightMeters": 2.1,
          "access": "level threshold"
        }
      ],
      "routeNodeIds": [],
      "source": {
        "kind": "deterministic_shell_derivation",
        "seed": "AXM-BUILDING-SHELLS-EXAMPLE-0100"
      }
    },
    {
      "id": "building_courtyard_walkup_s1_storey",
      "level": 1,
      "label": "Upper floor",
      "heightMeters": 3.1,
      "placeIds": [
        "home_courtyard_2"
      ],
      "wallGraph": {
        "nodes": [
          {
            "id": "building_courtyard_walkup_s1_nw",
            "x": 0,
            "y": 0,
            "z": 3.1
          },
          {
            "id": "building_courtyard_walkup_s1_ne",
            "x": 16,
            "y": 0,
            "z": 3.1
          },
          {
            "id": "building_courtyard_walkup_s1_se",
            "x": 16,
            "y": 8,
            "z": 3.1
          },
          {
            "id": "building_courtyard_walkup_s1_sw",
            "x": 0,
            "y": 8,
            "z": 3.1
          }
        ],
        "edges": [
          {
            "id": "building_courtyard_walkup_s1_north",
            "from": "building_courtyard_walkup_s1_nw",
            "to": "building_courtyard_walkup_s1_ne",
            "side": "north",
            "lengthMeters": 16,
            "kind": "exterior_wall",
            "openingIds": [
              "building_courtyard_walkup_s1_window_02",
              "building_courtyard_walkup_s1_window_06"
            ]
          },
          {
            "id": "building_courtyard_walkup_s1_east",
            "from": "building_courtyard_walkup_s1_ne",
            "to": "building_courtyard_walkup_s1_se",
            "side": "east",
            "lengthMeters": 8,
            "kind": "exterior_wall",
            "openingIds": [
              "building_courtyard_walkup_s1_window_03"
            ]
          },
          {
            "id": "building_courtyard_walkup_s1_south",
            "from": "building_courtyard_walkup_s1_se",
            "to": "building_courtyard_walkup_s1_sw",
            "side": "south",
            "lengthMeters": 16,
            "kind": "exterior_wall",
            "openingIds": [
              "building_courtyard_walkup_s1_window_01",
              "building_courtyard_walkup_s1_window_05"
            ]
          },
          {
            "id": "building_courtyard_walkup_s1_west",
            "from": "building_courtyard_walkup_s1_sw",
            "to": "building_courtyard_walkup_s1_nw",
            "side": "west",
            "lengthMeters": 8,
            "kind": "exterior_wall",
            "openingIds": [
              "building_courtyard_walkup_s1_window_04"
            ]
          }
        ]
      },
      "openings": [
        {
          "id": "building_courtyard_walkup_s1_window_01",
          "type": "window",
          "wallEdgeId": "building_courtyard_walkup_s1_south",
          "offsetRatio": 0.18,
          "widthMeters": 1.15,
          "heightMeters": 1.35,
          "sillMeters": 0.85,
          "sourcePlaceIds": [
            "home_courtyard_2"
          ]
        },
        {
          "id": "building_courtyard_walkup_s1_window_02",
          "type": "window",
          "wallEdgeId": "building_courtyard_walkup_s1_north",
          "offsetRatio": 0.41,
          "widthMeters": 1.15,
          "heightMeters": 1.35,
          "sillMeters": 0.85,
          "sourcePlaceIds": [
            "home_courtyard_2"
          ]
        },
        {
          "id": "building_courtyard_walkup_s1_window_03",
          "type": "window",
          "wallEdgeId": "building_courtyard_walkup_s1_east",
          "offsetRatio": 0.64,
          "widthMeters": 1.15,
          "heightMeters": 1.35,
          "sillMeters": 0.85,
          "sourcePlaceIds": [
            "home_courtyard_2"
          ]
        },
        {
          "id": "building_courtyard_walkup_s1_window_04",
          "type": "window",
          "wallEdgeId": "building_courtyard_walkup_s1_west",
          "offsetRatio": 0.23,
          "widthMeters": 1.15,
          "heightMeters": 1.35,
          "sillMeters": 0.85,
          "sourcePlaceIds": [
            "home_courtyard_2"
          ]
        },
        {
          "id": "building_courtyard_walkup_s1_window_05",
          "type": "window",
          "wallEdgeId": "building_courtyard_walkup_s1_south",
          "offsetRatio": 0.46,
          "widthMeters": 1.15,
          "heightMeters": 1.35,
          "sillMeters": 0.85,
          "sourcePlaceIds": [
            "home_courtyard_2"
          ]
        },
        {
          "id": "building_courtyard_walkup_s1_window_06",
          "type": "window",